	Unit	Values	Description
co2_sequestration_potential	MtCO2/a	float	The potential of sequestering CO2 in the spatial scope per year
natural gas			
#NAME?	bool	"{true, false}"	Allow natual gas import and export constraints between interconnect and neighbouring regions (includes both domestic and international trade)
#NAME?	bool	"{true, false}"	Copperplate gas network to a state level (only true implemented right now) 
#NAME?	bool	"{true, false}"	Natural gas underground storage cyclic constraint 
heating			
#NAME?	°C	float	The temperature heat sink used in heat pumps based on DTU / large area radiators. The value is conservatively high to cover hot water and space heating in poorly-insulated buildings
